{
  "escalate_to_human": true,
  "priority_order": [
    "RP-181",
    "RP-401"
  ],
  "recommended_actions": [
    {
      "action": "continue_program",
      "allocation_ratio": 0.51,
      "branch_budget": 3,
      "execution_state": "active",
      "opportunity_score": 0.674,
      "program_id": "RP-181",
      "program_title": "Cross-Domain Thermal Analogies",
      "rationale": "Cross-Domain Thermal Analogies has opportunity score 0.674 and allocation ratio 0.51, so the recommended action is continue_program.",
      "scope_level": "L3",
      "target_domain": "cross-domain cooling analogies"
    },
    {
      "action": "continue_program",
      "allocation_ratio": 0.49,
      "branch_budget": 3,
      "execution_state": "active",
      "opportunity_score": 0.647,
      "program_id": "RP-401",
      "program_title": "Data Center Thermal Systems",
      "rationale": "Data Center Thermal Systems has opportunity score 0.647 and allocation ratio 0.49, so the recommended action is continue_program.",
      "scope_level": "L2",
      "target_domain": "data center cooling"
    }
  ],
  "recommended_branch_budget": 3,
  "strategy_summary": "Focus on Cross-Domain Thermal Analogies with continue_program and branch budget 3.",
  "type": "EXPLORATION_CONTROL_RECOMMENDATION"
}
