{
  "escalate_to_human": true,
  "priority_order": [
    "RP-401",
    "RP-181"
  ],
  "recommended_actions": [
    {
      "action": "continue_program",
      "allocation_ratio": 0.502,
      "branch_budget": 3,
      "execution_state": "active",
      "opportunity_score": 0.66,
      "program_id": "RP-401",
      "program_title": "Data Center Thermal Systems",
      "rationale": "Data Center Thermal Systems has opportunity score 0.66 and allocation ratio 0.502, so the recommended action is continue_program.",
      "scope_level": "L2",
      "target_domain": "data center cooling"
    },
    {
      "action": "continue_program",
      "allocation_ratio": 0.498,
      "branch_budget": 3,
      "execution_state": "active",
      "opportunity_score": 0.656,
      "program_id": "RP-181",
      "program_title": "Cross-Domain Thermal Analogies",
      "rationale": "Cross-Domain Thermal Analogies has opportunity score 0.656 and allocation ratio 0.498, so the recommended action is continue_program.",
      "scope_level": "L3",
      "target_domain": "cross-domain cooling analogies"
    }
  ],
  "recommended_branch_budget": 3,
  "strategy_summary": "Focus on Data Center Thermal Systems with continue_program and branch budget 3.",
  "type": "EXPLORATION_CONTROL_RECOMMENDATION"
}
